{
  "specVersion": "wis-candidate",
  "coreVersion": "0.1.0-draft",
  "schemaId": "https://schemas.workspai.dev/wis/core/result-envelope/0.1.0-draft",
  "profile": { "id": "wis.profile.fixture", "version": "0.1.0-draft" },
  "producer": { "id": "fixture-producer", "version": "1.0.0" },
  "operation": "evaluate-fixture",
  "scope": { "kind": "workspace", "workspaceId": "workspace:fixture" },
  "generation": {
    "id": "generation:previous-pass:1",
    "generatedAt": "2026-08-13T00:00:00.000Z"
  },
  "outcome": "pass",
  "payload": { "summary": "previous fixture passed" },
  "evidence": [],
  "freshness": { "status": "current", "evaluatedAt": "2026-08-13T00:00:00.000Z" },
  "unknowns": [],
  "omissions": [],
  "diagnostics": []
}
